{
  "id": "crud_web_app_basic",
  "title": "CRUD Web App Basic Workflow",
  "version": "1.0.0",
  "keywords": [
    "crud",
    "web",
    "app",
    "form",
    "database",
    "validation"
  ],
  "task_type": [
    "coding",
    "web-app",
    "crud"
  ],
  "good_for": [
    "Admin data entry tools",
    "Small internal dashboards",
    "Form-backed resource management"
  ],
  "summary_compact": "Build a small create, read, update, delete web application with clear data contracts, validation, and focused tests.",
  "paths": {
    "source": "methodblocks/coding/crud_web_app.yaml",
    "compact": "compiled/coding/crud_web_app.compact.md",
    "graph": "compiled/coding/crud_web_app.graph.json"
  }
}
